厅出阳台，采光好，小区管理，满五年,东浚荔景苑,中山八,3室2厅 ,112.59, 东北 , 其他 ,37,1998, 塔楼,1,22,4730000.0,"42,011元/平",近地铁 VR看装修 房本满五年 
福盛花苑 新上好房 近地铁 配套成熟完善 小区管理,福盛花苑,广钢新城,3室1厅 ,78.12, 西北 , 简装 ,8,1998, 塔楼,0,31,2100000.0,"26,882元/平",近地铁 VR看装修 房本满两年 
此房过五、东向通透格局、采光充足 、配套设施齐全,珠岛花园,大坦沙,2室1厅 ,45.0, 东 , 其他 ,9,1995, 板塔结合,0,27,1800000.0,"40,000元/平",近地铁 VR看装修 房本满两年 
逸翠湾少有精装三房  高层视野开阔,逸翠湾,黄沙,3室2厅 ,103.05, 东 北 , 其他 ,49,2009, 塔楼,1,27,6650000.0,"64,532元/平",近地铁 VR看装修 房本满两年 
福盛花苑，满五年，原装3房，采光充足，通风良好,福盛花苑,广钢新城,3室1厅 ,78.65, 西南 , 其他 ,6,1998, 塔楼,1,31,2050000.0,"26,065元/平",近地铁 VR房源 房本满五年 
广钢观鹤小区，近鹤洞地铁，满五，社区舒适，环境美,广钢观鹤小区,广钢新城,2室2厅 ,60.62, 南 北 , 其他 ,8,1997, 塔楼,0,31,2200000.0,"36,292元/平",VR看装修 房本满两年 
陈家祠双地铁  金花小区厅出阳台 2房 保养好 有电梯位,金花小区,西华路,2室1厅 ,49.44, 东 , 简装 ,9,1999, 塔楼,0,28,2050000.0,"41,465元/平",近地铁 VR看装修 房本满五年 
光复大厦 厅出阳台 间隔很方正 产权清晰,光复大厦,人民路,3室1厅 ,83.13, 东南 , 简装 ,28,2000, 塔楼,0,25,3550000.0,"42,705元/平",近地铁 VR看装修 房本满五年 
新装修 安静望花园 11号地铁线 全明屋,如意阁,芳村,2室1厅 ,51.79, 北 , 其他 ,8,2001, 塔楼,0,21,1400000.0,"27,033元/平",VR看装修 房本满两年 
陈家祠1/8号线双地铁大院管理户型方正采光三房配套全,龙津东路,龙津,3室1厅 ,59.56, 南 , 精装 ,8,1990, 塔楼,3,29,2280000.0,"38,281元/平",近地铁 VR看装修 房本满两年 
此房满五年唯一，格局方正实用，房屋通风，光线好,芬芳小区,汾水,3室1厅 ,82.69, 北 , 简装 ,9,1996, 塔楼,3, 一年前发布,2300000.0,"27,815元/平",VR看装修 房本满五年 
芳村地铁 新小区 丽和华庭 正规两房 东南向 ！,丽和华庭,茶,2室1厅 ,64.0, 东南 , 简装 ,14,2011, 塔楼,11, 一年前发布,3400000.0,"53,125元/平",近地铁 VR看装修 房本满两年 
茶蛐∏ 电梯三房 东南向 厅出阳台,茶蚵10-30号小区,茶,3室2厅 ,94.01, 东南 , 简装 ,9,1998, 塔楼,2, 11个月以前发布,3260000.0,"34,678元/平",VR看装修 房本满五年 
广佛地铁鹤洞站旁，满五免重税，电梯已加装可使用。,芳华阁,鹤洞,2室1厅 ,75.21, 东南 , 精装 ,9,1994, 塔楼,3, 一年前发布,2370000.0,"31,512元/平",近地铁 VR看装修 房本满五年 
朝花园平台，望广州塔 夜景好 证满五年,乐怡居,花地湾,2室1厅 ,76.58, 东 东南 , 精装 ,31,1996, 塔楼,1, 一年前发布,3220000.0,"42,048元/平",近地铁 VR房源 房本满五年 
南向高层，基本全新大三房带阳台，无需装修可直住。,远大芳华都汇,西朗,3室2厅 ,113.53, 西南 , 精装 ,28,2010, 塔楼,64, 一年前发布,2300000.0,"20,259元/平",房本满两年 
业主自住 装修保养好 近地铁 配套齐全,红棉苑南区,花地湾,3室1厅 ,100.44, 东 东南 西南 , 简装 ,9,2000, 塔楼,2, 一年前发布,3700000.0,"36,838元/平",近地铁 VR看装修 房本满五年 
邦华星际广场一期 2室1厅 南,邦华星际广场一期,龙溪,2室1厅 ,66.54, 南 , 其他 ,22,2015, 塔楼,10, 一年前发布,1750000.0,"26,300元/平",房本满五年 
邦华星际 南向 复式精装2房2卫 双阳台  采光通风好,邦华星际广场一期,龙溪,2室2厅 ,66.1, 南 , 其他 ,22,2015, 塔楼,18, 一年前发布,1400000.0,"21,181元/平",房本满五年 
芳村地铁站 怡芳苑电梯对流大两房 商品房 满五唯一,怡芳苑,花地湾,2室2厅 ,83.2, 北 , 简装 ,9,1998, 塔楼,0, 4个月以前发布,3150000.0,"37,861元/平",近地铁 VR看装修 房本满五年 
中海锦汇华庭（A区） 3室1厅 南,中海锦汇华庭（A区）,广钢新城,3室1厅 ,71.0, 南 , 精装 ,21,2019, 塔楼,10, 一年前发布,2580000.0,"36,339元/平",近地铁 房本满两年 
芳村花园 南向大2房 望花园 采光好,芳村花园,坑口,2室2厅 ,96.48, 南 , 精装 ,32,1999, 塔楼,3, 1个月以前发布,3250000.0,"33,686元/平",近地铁 VR看装修 房本满两年 
新世界凯粤湾 看江三房 五号线  产权清晰 配套齐全,新世界凯粤湾,蚩,3室1厅 ,91.85, 南 北 , 简装 ,33,2012, 塔楼,4, 6个月以前发布,4300000.0,"46,816元/平",近地铁 VR看装修 房本满两年 
中海锦汇华庭A区，复式三房精装，交通便利配套完善。,中海锦汇华庭（A区）,广钢新城,3室2厅 ,71.0, 东北 , 精装 ,21,2019, 塔楼,9, 一年前发布,2700000.0,"38,029元/平",近地铁 房本满五年 
三房东南向  满五唯一，采光充足，视野宽阔,金鹤苑,西朗,3室1厅 ,73.47, 东南 , 简装 ,7,2000, 板楼,55, 一年前发布,1780000.0,"24,228元/平",VR看装修 房本满五年 
南向三房  可明火  可注册公司  优惠,中海锦汇华庭（A区）,广钢新城,3室1厅 ,55.0, 南 , 精装 ,21,2019, 塔楼,1, 1个月以前发布,1980000.0,"36,000元/平",近地铁 房本满两年 
鸿图苑小区 低楼层实用三房 近花地湾 南北向 满五年,鸿图苑,汾水,3室1厅 ,80.54, 南 , 简装 ,9,1995, 塔楼,6, 一年前发布,2300000.0,"28,558元/平",VR看装修 房本满两年 
汾水金兰苑 电梯南向3房 证满5年唯一物业,金兰苑,汾水,3室2厅 ,107.0, 南 , 其他 ,22,2001, 塔楼,14, 11个月以前发布,3180000.0,"29,720元/平",VR看装修 房本满五年 
电梯三房 装修保养新 采光好 交通便利,远大芳华都汇,西朗,3室2厅 ,113.53, 南 , 精装 ,28,2010, 塔楼,0, 1个月以前发布,2150000.0,"18,938元/平",房本满两年 
富力环市西苑电梯楼小区管理   高楼层  阳台望花园,富力环市西苑,西村,2室1厅 ,69.36, 东 , 简装 ,15,2000, 塔楼,8, 7个月以前发布,3800000.0,"54,787元/平",近地铁 VR看装修 房本满两年 
邦华星际一期  4房复式2层带装修  交通方便  上学近,邦华星际广场一期,龙溪,4室1厅 ,84.26, 东南 , 简装 ,22,2015, 塔楼,2, 4个月以前发布,1800000.0,"21,363元/平",房本满五年 
怡芳苑 1室1厅 东南,怡芳苑,花地湾,1室1厅 ,38.24, 东南 , 精装 ,9,1998, 塔楼,0, 1个月以前发布,1650000.0,"43,149元/平",近地铁 VR房源 房本满两年 
陈家祠广场旁 原装电梯南向大两房,汇鑫阁,龙津,2室2厅 ,87.04, 南 , 精装 ,22,1999, 塔楼,0,29,4150000.0,"47,680元/平",近地铁 VR看装修 房本满五年 
芬芳小区 2室1厅 南,芬芳小区,汾水,2室1厅 ,60.04, 南 , 其他 ,9,1996, 塔楼,0,24,1550000.0,"25,817元/平",VR看装修 房本满五年 
桥东小区 1室1厅 东南,桥东小区,蚩,1室1厅 ,51.78, 东南 , 简装 ,9,1995, 塔楼,1,23,1580000.0,"30,514元/平",VR看装修 房本满五年 
电梯 大院管理 六号线和八号线文化公园站,六二三路,和平西,2室1厅 ,108.17, 南 , 简装 ,8,1989, 塔楼,0,29,4100000.0,"37,904元/平",近地铁 VR看装修 房本满五年 
环翠园  两房户型  东南向  厅出阳台,环翠园,南岸路,2室1厅 ,64.85, 南 , 简装 ,9,1994, 塔楼,1, 1个月以前发布,2200000.0,"33,925元/平",近地铁 VR看装修 房本满五年 
鸿图苑 2室1厅 南,鸿图苑,汾水,2室1厅 ,63.16, 南 , 其他 ,9,1995, 塔楼,0, 1个月以前发布,1750000.0,"27,708元/平",近地铁 VR房源 房本满两年 
接龙里小区 2室1厅 南,接龙里小区,芳村,2室1厅 ,50.53, 南 , 其他 ,8,2005, 塔楼,0,23,1300000.0,"25,728元/平",近地铁 VR看装修 房本满五年 
文昌雅居 3室2厅 东北,文昌雅居,龙津,3室2厅 ,86.31, 东北 , 其他 ,32,2005, 塔楼,0,30,5000000.0,"57,931元/平",VR看装修 房本满五年 
黄沙地铁站，詹天佑旁，框架结构,丛桂路,黄沙,3室1厅 ,73.84, 北 , 其他 ,9,1994, 塔楼,0,20,1950000.0,"26,409元/平",近地铁 VR看装修 房本满五年 
温馨家园靓装修，低楼层，双地铁沿线，广钢新城旁,华丽苑,鹤洞,1室1厅 ,50.59, 东北 , 精装 ,9,1996, 塔楼,1,24,1380000.0,"27,279元/平",近地铁 VR房源 房本满五年 
花地河湾中空复式5房 保养良好 望花地河视野开阔,花地河湾,西朗,5室2厅 ,75.18, 东南 , 其他 ,22,2009, 塔楼,0,28,3050000.0,"40,570元/平",VR房源 房本满五年 
温馨家园靓装修，低楼层，双地铁沿线，广钢新城旁,华丽苑,鹤洞,1室1厅 ,56.29, 东北 , 精装 ,9,1996, 塔楼,1,24,1480000.0,"26,293元/平",近地铁 VR房源 房本满五年 
满五不唯一，全明三房，南北通透望花园，装修保养新,富力广场B区,中山八,3室2厅 ,87.78, 南 北 , 精装 ,23,2005, 塔楼,0,25,4500000.0,"51,265元/平",近地铁 VR看装修 房本满五年 
一线江景，南北对流，三代同堂宜居大宅,荔港南湾,南岸路,4室2厅 ,142.98, 西南 , 精装 ,34,2008, 塔楼,0,28,7880000.0,"55,113元/平",VR房源 房本满五年 
商品 居住舒适，生活配套齐全，广雅 上车盘,西场电器城,西村,3室1厅 ,62.71, 东 东南 , 其他 ,8,1980, 塔楼,0, 1个月以前发布,1890000.0,"30,139元/平",近地铁 VR看装修 房本满五年 
环翠园格局方正，业主诚*，环翠园小区生活舒适,环翠园,南岸路,2室1厅 ,64.1, 北 , 简装 ,9,1994, 塔楼,29, 一年前发布,1738000.0,"27,114元/平",近地铁 VR看装修 房本满五年 随时看房 
满五非唯一.看房可以.联系维护人,环翠园,南岸路,2室1厅 ,56.93, 东 , 简装 ,9,1994, 塔楼,54, 一年前发布,1550000.0,"27,227元/平",近地铁 VR看装修 房本满五年 随时看房 
5号线中山八，大型社区，市场近，有天台,环翠园,南岸路,2室1厅 ,51.0, 南 , 精装 ,9,1994, 塔楼,82, 一年前发布,1400000.0,"27,451元/平",近地铁 VR看装修 房本满两年 随时看房 
广船鹤园小区，鹤洞地铁 户型方正 南向通风好,广船鹤园小区,鹤洞,1室1厅 ,40.64, 南 , 简装 ,5,1999, 塔楼,20, 6个月以前发布,880000.0,"21,654元/平",近地铁 VR看装修 房本满五年 随时看房 
通风采光好 楼龄新 交通方便 适宜居住，配套设施齐全,业丰花园,西村,2室1厅 ,46.26, 南 , 其他 ,9,2000, 塔楼,2, 4个月以前发布,1300000.0,"28,103元/平",近地铁 VR看装修 房本满五年 随时看房 
荔港小区F区中高层东南向看花园2房,荔港南湾,南岸路,2室1厅 ,79.65, 东南 , 简装 ,34,2008, 塔楼,3, 3个月以前发布,4000000.0,"50,220元/平",VR房源 房本满五年 随时看房 
万科海上传奇 环境优美 交通便利,万科海上传奇,芳村,1室1厅 ,27.61, 东 , 其他 ,17,2016, 板塔结合,9, 一年前发布,1540000.0,"55,777元/平",近地铁 房本满两年 随时看房 
小康人家1号线坑口站电梯3房产权清晰证过5年采光好,小康人家,坑口,3室1厅 ,115.31, 东南 东北 , 精装 ,11,2002, 塔楼,85, 一年前发布,3600000.0,"31,221元/平",近地铁 VR看装修 房本满五年 随时看房 
荔尚国际中层三房，采光优质，保养新净，对应将光鼐,荔尚国际,西关,3室1厅 ,100.47, 东 , 简装 ,17,2008, 塔楼,10, 9个月以前发布,5990000.0,"59,620元/平",VR房源 房本满五年 
东南靓向  证满五年  采光充足 看房方便,鸿图苑,汾水,1室1厅 ,52.42, 东南 , 精装 ,9,1995, 塔楼,16, 5个月以前发布,1350000.0,"25,754元/平",VR房源 房本满五年 随时看房 
陈家祠 汇鑫阁 复式单位 2个大露台不计入房产面积,汇鑫阁,龙津,5室2厅 ,233.78, 北 , 其他 ,22,1999, 塔楼,13, 6个月以前发布,10800000.0,"46,198元/平",近地铁 VR房源 房本满五年 随时看房 
金奴大厦，南向大三房户型实用，位置优越,金奴大厦,陈家祠,3室2厅 ,100.33, 南 , 精装 ,9,1996, 塔楼,75, 9个月以前发布,3330000.0,"33,191元/平",VR房源 房本满五年 随时看房 
荔港南湾实用小三房，采光好，过五年，方便看房,荔港南湾,南岸路,3室2厅 ,76.08, 东北 , 简装 ,32,2008, 塔楼,48, 4个月以前发布,3870000.0,"50,868元/平",近地铁 VR看装修 房本满五年 随时看房 
东浚荔景苑 视野开阔望白云山三房两卫 双阳台厅出阳台,东浚荔景苑,中山八,3室2厅 ,112.91, 东北 , 简装 ,37,2003, 塔楼,0, 2个月以前发布,5400000.0,"47,826元/平",近地铁 VR看装修 房本满五年 随时看房 
证满五年 房改房 采光好 户型方正 11号线地铁站在建,接龙里小区,芳村,1室1厅 ,27.51, 南 北 , 简装 ,7,2005, 塔楼,8, 5个月以前发布,700000.0,"25,446元/平",近地铁 VR房源 房本满五年 随时看房 
五号线西场地铁口 优质大三房 广雅 交通便利 配套齐全,和平南小区,西场,3室1厅 ,79.95, 南 , 其他 ,8,1990, 塔楼,8, 一年前发布,2400000.0,"30,019元/平",近地铁 VR看装修 房本满两年 随时看房 
全明三房 厅出阳台 无遮挡 采光通风好,荔尚国际,西关,3室1厅 ,101.53, 北 , 精装 ,17,2008, 塔楼,30, 一年前发布,4550000.0,"44,815元/平",近地铁 VR房源 房本满五年 随时看房 
商品房，房产证已过五年物业，成熟小区交通便利。,合兴苑,花地湾,2室1厅 ,57.78, 东南 , 其他 ,7,1997, 板楼,4, 4个月以前发布,1450000.0,"25,096元/平",近地铁 VR看装修 房本满五年 随时看房 
茶蛐麓 电梯两房 安静看花园 户型方正 生活便利,茶蛐麓,茶,2室1厅 ,55.72, 北 , 其他 ,7,1985, 塔楼,1, 4个月以前发布,1800000.0,"32,305元/平",近地铁 VR看装修 房本满五年 随时看房 
福盛花园 满五年 户型方正 交通便捷,福盛花苑,广钢新城,2室2厅 ,60.17, 东 , 简装 ,7,1998, 塔楼,6, 2个月以前发布,1680000.0,"27,921元/平",近地铁 VR房源 房本满五年 随时看房 
荔湾广场南塔中层 康王南路新装修三房,荔湾广场,人民路,3室1厅 ,79.6, 东南 , 其他 ,30,2000, 板塔结合,0, 2个月以前发布,2280000.0,"28,644元/平",近地铁 VR房源 房本满五年 随时看房 
上下九步行街 双地铁交汇 随时看房,杨巷路,人民路,3室1厅 ,65.88, 东南 , 精装 ,7,1999, 塔楼,18, 11个月以前发布,1980000.0,"30,055元/平",近地铁 VR看装修 房本满五年 随时看房 
此房满五唯一，交通便利，户型方正实用,芳村大道西,蚩,2室1厅 ,41.51, 南 , 简装 ,9,1988, 塔楼,190, 一年前发布,920000.0,"22,164元/平",近地铁 VR看装修 房本满五年 
南向 通风采光好 实用率高 楼龄新 交通便利,东鹏花园三期,坑口,2室2厅 ,65.73, 东南 , 其他 ,9,1999, 塔楼,2, 7个月以前发布,2000000.0,"30,428元/平",近地铁 VR看装修 房本满两年 随时看房 
精装修 电梯房 芳村地铁600m  诚意放卖 有匙即看,乌石墩小区,芳村,2室1厅 ,58.85, 东南 , 精装 ,9,1996, 塔楼,72, 9个月以前发布,1800000.0,"30,587元/平",近地铁 VR看装修 房本满两年 随时看房 
南向四房 望花园 中楼层单位   通风采光好,芳村花园,坑口,4室1厅 ,143.15, 南 , 简装 ,30,1999, 塔楼,26, 一年前发布,5790000.0,"40,448元/平",近地铁 VR房源 房本满五年 随时看房 
流花湖畔 南向望湖 精装两房 视野开阔 环境优美,流花路,流花站前,2室1厅 ,45.3, 南 , 精装 ,9,1988, 暂无数据,130, 一年前发布,1480000.0,"32,672元/平",近地铁 VR看装修 房本满五年 随时看房 
桥中花园 二房一厅 间隔方正实用 通风对流,桥中花园,大坦沙,2室1厅 ,42.26, 东南 , 毛坯 ,9,2000, 塔楼,63, 一年前发布,1020000.0,"24,137元/平",近地铁 VR看装修 房本满五年 随时看房 
电梯平层 正南向方正三房  带80平天台花园  近小西关,周门小区中兴苑,周门,3室2厅 ,80.53, 南 , 简装 ,9,1998, 塔楼,10, 2个月以前发布,3100000.0,"38,495元/平",近地铁 VR看装修 房本满五年 随时看房 
花蕾路 实用两房 中层单位 地段成熟 适宜居住,花蕾路,花地湾,2室1厅 ,52.73, 南 , 其他 ,7,1989, 板楼,0, 1个月以前发布,1400000.0,"26,551元/平",近地铁 VR看装修 房本满五年 随时看房 
刚需好选择，满五年不唯一，南向厅出阳台，陈家祠1-8,康王阁,西华路,1室0厅 ,36.7, 南 , 精装 ,20,2003, 塔楼,45, 一年前发布,1750000.0,"47,684元/平",近地铁 VR看装修 房本满五年 随时看房 
环翠园格局方正，业主诚*，环翠园小区生活舒适,环翠园,南岸路,2室1厅 ,64.1, 北 , 简装 ,9,1994, 塔楼,29, 一年前发布,1738000.0,"27,114元/平",近地铁 VR看装修 房本满五年 随时看房 
通风采光好 楼龄新 交通方便 适宜居住，配套设施齐全,业丰花园,西村,2室1厅 ,46.26, 南 , 其他 ,9,2000, 塔楼,2, 4个月以前发布,1300000.0,"28,103元/平",近地铁 VR看装修 房本满五年 随时看房 
5号线中山八，大型社区，市场近，有天台,环翠园,南岸路,2室1厅 ,51.0, 南 , 精装 ,9,1994, 塔楼,82, 一年前发布,1400000.0,"27,451元/平",近地铁 VR看装修 房本满两年 随时看房 
04年楼龄满五年不唯一；格局方正，采光通风好,南源花园,南岸路,3室1厅 ,80.0, 西南 , 其他 ,17,2004, 塔楼,1, 1个月以前发布,3280000.0,"41,000元/平",近地铁 VR房源 房本满五年 随时看房 
广船鹤园小区，鹤洞地铁 户型方正 南向通风好,广船鹤园小区,鹤洞,1室1厅 ,40.64, 南 , 简装 ,5,1999, 塔楼,20, 6个月以前发布,880000.0,"21,654元/平",近地铁 VR看装修 房本满五年 随时看房 
满五非唯一.看房可以.联系维护人,环翠园,南岸路,2室1厅 ,56.93, 东 , 简装 ,9,1994, 塔楼,54, 一年前发布,1550000.0,"27,227元/平",近地铁 VR看装修 房本满五年 随时看房 
西湾苑小区  框架结构   中高层  欢迎看房,西湾苑,西村,2室1厅 ,54.22, 南 , 简装 ,9,1980, 塔楼,1, 2个月以前发布,2200000.0,"40,576元/平",近地铁 VR看装修 房本满两年 随时看房 
荔港小区F区中高层东南向看花园2房,荔港南湾,南岸路,2室1厅 ,79.65, 东南 , 简装 ,34,2008, 塔楼,3, 3个月以前发布,4000000.0,"50,220元/平",VR房源 房本满五年 随时看房 
实用三房望公园视野好 厅大房大,逢源大厦,西关,3室1厅 ,110.11, 西南 , 其他 ,25,2014, 塔楼,8, 6个月以前发布,4180000.0,"37,963元/平",近地铁 VR看装修 房本满五年 随时看房 
西门口原装电梯物业 东西对流  业主诚意放卖 可议,安富花园,龙津,3室2厅 ,103.7, 东 西 , 其他 ,26,1998, 塔楼,14, 4个月以前发布,4120000.0,"39,730元/平",VR房源 房本满五年 随时看房 
东浚荔景苑  安静三房  阳台景观很棒yyds 西外,东浚荔景苑,中山八,3室1厅 ,96.2, 东北 , 精装 ,37,1998, 塔楼,3, 5个月以前发布,4500000.0,"46,778元/平",近地铁 VR房源 房本满五年 随时看房 
金翠园  中楼层 户型方正 视野开阔,金翠苑,南岸路,2室2厅 ,61.78, 北 , 简装 ,9,2000, 塔楼,0, 5个月以前发布,2120000.0,"34,316元/平",近地铁 VR看装修 房本满五年 随时看房 
电梯两房 交通便利 生活配套成熟 户型方正,多宝华厦,西关,2室1厅 ,36.22, 东 , 精装 ,33,2000, 塔楼,20, 一年前发布,1600000.0,"44,175元/平",近地铁 VR看装修 房本满五年 随时看房 
东浚方正东南向户型，装修保养好，采光好,东浚荔景苑,中山八,2室1厅 ,79.93, 东 , 简装 ,37,1998, 塔楼,2, 4个月以前发布,4080000.0,"51,045元/平",近地铁 VR看装修 房本满五年 随时看房 
电梯小两房，装修保养好，证过五年,兴东阁,蚩,2室1厅 ,50.44, 西南 , 精装 ,9,1999, 塔楼,1, 1个月以前发布,1400000.0,"27,756元/平",VR看装修 房本满两年 随时看房 
金兰苑 电梯房 证过5年 唯一 东向望花园,金兰苑,汾水,1室1厅 ,49.35, 东 , 毛坯 ,9,2001, 塔楼,1, 2个月以前发布,1480000.0,"29,990元/平",VR看装修 房本满五年 随时看房 
电梯正在施工   实用户型两房    满五唯一,鸿图苑,汾水,2室1厅 ,52.0, 西 , 简装 ,9,1995, 塔楼,2, 2个月以前发布,1550000.0,"29,808元/平",近地铁 VR看装修 房本满五年 随时看房 
芳村花园小区 满5唯一 南向望花园  交通方便  环境好,芳村花园,坑口,3室2厅 ,96.48, 南 , 简装 ,32,1999, 塔楼,30, 6个月以前发布,3330000.0,"34,515元/平",近地铁 VR看装修 房本满五年 随时看房 
永安居   方正两房   原装电梯   交通便利,永安居,西村,2室1厅 ,68.76, 南 , 精装 ,13,1998, 塔楼,10, 一年前发布,2360000.0,"34,323元/平",近地铁 VR看装修 房本满两年 随时看房 
省学 高层视野无遮挡 原装电梯 小区管理 南北通透,多宝华厦,西关,3室1厅 ,114.09, 南 北 , 精装 ,33,2000, 塔楼,24, 9个月以前发布,5080000.0,"44,527元/平",近地铁 VR看装修 房本满五年 随时看房 
电梯一房，户型格局方正，通风对流。,芳华苑,芳村,1室1厅 ,29.87, 南 , 简装 ,9,1999, 塔楼,22, 4个月以前发布,850000.0,"28,457元/平",VR看装修 房本满五年 随时看房 
金宇花园 中高层两房 采光通风好 户型方正实用,金宇花园,东i,2室1厅 ,55.12, 南 , 精装 ,9,1999, 塔楼,5, 2个月以前发布,1380000.0,"25,037元/平",VR看装修 房本满五年 随时看房 
南向两房 满五唯一 可装电梯 天台可用 近花地湾地铁,鸿图苑,汾水,2室2厅 ,53.4, 南 , 精装 ,9,1995, 塔楼,30, 5个月以前发布,1320000.0,"24,720元/平",VR看装修 房本满五年 随时看房 
多宝华厦 实用一房一厅 交通便利 配套完善 随时看房,多宝华厦,西关,1室1厅 ,36.22, 东 , 简装 ,33,2000, 塔楼,0, 4个月以前发布,1700000.0,"46,936元/平",近地铁 VR房源 房本满两年 随时看房 
文昌南路 全新装修没住过 马赛克外墙 满五唯一,文昌南路,西关,3室1厅 ,64.16, 东南 , 精装 ,10,1994, 塔楼,76, 11个月以前发布,1650000.0,"25,717元/平",近地铁 VR看装修 房本满五年 随时看房 
中层三房，东南向厅出阳台，装修新净，加装电梯筹备中,金花小区,西华路,3室1厅 ,83.72, 东南 , 简装 ,9,1992, 塔楼,26, 4个月以前发布,2780000.0,"33,206元/平",VR看装修 房本满两年 随时看房 
电梯2房，19年买来的，精装修，各负各税,田间苑小区,南岸路,2室1厅 ,57.72, 东南 , 其他 ,9,1988, 塔楼,5, 2个月以前发布,2050000.0,"35,517元/平",近地铁 VR看装修 房本满两年 随时看房 
华贵路 私家天台 三室二厅 全明屋,华贵路,龙津,3室2厅 ,103.26, 南 , 精装 ,3,1995, 板楼,9, 4个月以前发布,3600000.0,"34,864元/平",VR看装修 房本满五年 随时看房 
满五！全新高档装修未入住，双地铁交通便利，配套成熟,金道花园,鹤洞,2室1厅 ,41.62, 南 北 , 精装 ,9,2000, 塔楼,45, 一年前发布,1570000.0,"37,723元/平",近地铁 VR房源 房本满五年 随时看房 
精装修，中楼层，东南向，近地铁，配套完善,怡康苑,鹤洞,1室1厅 ,51.04, 东南 , 精装 ,30,2000, 塔楼,11, 9个月以前发布,1900000.0,"37,226元/平",近地铁 VR看装修 房本满两年 随时看房 
谊园小区 2室1厅 西北,谊园小区,黄沙,2室1厅 ,86.11, 西北 , 简装 ,9,1994, 塔楼,0, 4个月以前发布,3592000.0,"41,715元/平",近地铁 VR房源 房本满五年 随时看房 
芳雅苑，刚需两房，环境优美，采光通透，,芳雅苑,蚩,2室1厅 ,38.81, 南 , 精装 ,9,1995, 塔楼,17, 6个月以前发布,1150000.0,"29,632元/平",VR房源 房本满两年 随时看房 
祥日苑，户型方正，子过五年物业，免重税,祥日苑,龙津,3室1厅 ,80.14, 西南 西北 , 其他 ,9,1998, 塔楼,0, 5个月以前发布,2500000.0,"31,196元/平",VR房源 房本满五年 随时看房 
桥兴苑 2室1厅 南,桥兴苑,蚩,2室1厅 ,42.0, 南 , 简装 ,9,1995, 塔楼,1, 5个月以前发布,950000.0,"22,620元/平",VR看装修 房本满两年 随时看房 
东南单边位 厅出阳台 低楼层 全明屋,惠城花园,龙津,2室1厅 ,59.4, 东南 , 简装 ,9,1996, 塔楼,9, 一年前发布,2400000.0,"40,405元/平",近地铁 VR看装修 房本满两年 随时看房 
东浚荔景苑  安静三房  阳台景观很棒yyds 西外,东浚荔景苑,中山八,3室1厅 ,96.2, 东北 , 精装 ,37,1998, 塔楼,3, 5个月以前发布,4500000.0,"46,778元/平",近地铁 VR房源 房本满五年 随时看房 
过五唯一耀华社区 重建新装修独栋私房首层，地铁口,耀华社区安华里,西关,3室2厅 ,92.28, 南 北 , 精装 ,3,2001, 板楼,6, 7个月以前发布,3180000.0,"34,461元/平",近地铁 VR看装修 房本满两年 随时看房 
东浚方正东南向户型，装修保养好，采光好,东浚荔景苑,中山八,2室1厅 ,79.93, 东 , 简装 ,37,1998, 塔楼,2, 4个月以前发布,4080000.0,"51,045元/平",近地铁 VR看装修 房本满五年 随时看房 
电梯房，交通方便，康有为，近地铁，公园就在旁边,兰兴苑,芳村,2室2厅 ,70.36, 东南 , 精装 ,9,1990, 板楼,3, 8个月以前发布,2210000.0,"31,410元/平",近地铁 VR看装修 房本满五年 随时看房 
三面单边高层，视野开阔，三分地铁站,中山七路,龙津,3室2厅 ,70.12, 东 西 , 简装 ,7,1991, 塔楼,1, 2个月以前发布,2100000.0,"29,949元/平",VR看装修 房本满五年 随时看房 
西门口原装电梯物业 东西对流  业主诚意放卖 可议,安富花园,龙津,3室2厅 ,103.7, 东 西 , 其他 ,26,1998, 塔楼,14, 4个月以前发布,4120000.0,"39,730元/平",VR房源 房本满五年 随时看房 
荔港南湾，采光好，通风好，户型好，视觉好,荔港南湾,南岸路,3室1厅 ,145.27, 西南 , 精装 ,34,2008, 塔楼,10, 一年前发布,6950000.0,"47,842元/平",VR房源 房本满五年 随时看房 
