建设三马路 商品房 两房精装 户型方正带阳台 过五年,建设三马路,建设路,2室1厅 ,60.97, 东南 , 其他 ,8,1985, 板楼,2, 6个月以前发布,3360000.0,"55,110元/平",近地铁 VR看装修 房本满五年 随时看房 
大德路户型方正，光线刺眼，通风顺畅，舒适两房,大德路,解放南,2室1厅 ,68.43, 南 , 其他 ,9,1990, 塔楼,22, 一年前发布,2190000.0,"32,004元/平",VR看装修 房本满五年 随时看房 
东方广场 电梯两房 南北对流 通风采光好,东方广场,环市东,2室1厅 ,73.81, 南 北 , 其他 ,32,1998, 塔楼,7, 6个月以前发布,7000000.0,"94,839元/平",VR看装修 房本满五年 随时看房 
户型方正实用 生活配套方便 旺中带静,嘉颐居,建设路,3室1厅 ,95.08, 东 北 , 简装 ,8,2006, 塔楼,40, 一年前发布,6250000.0,"65,735元/平",近地铁 VR看装修 房本满两年 随时看房 
公园前地铁 文星阁电梯三房 东向厅出大阳台,文星阁,北京路,3室2厅 ,106.37, 南 北 , 精装 ,32,2001, 塔楼,7, 3个月以前发布,7200000.0,"67,689元/平",近地铁 VR看装修 房本满五年 随时看房 
文德雅轩 电梯精致三房 通风采光 厅出阳台,文德雅轩,越秀南,3室1厅 ,92.56, 北 , 精装 ,24,2005, 塔楼,16, 4个月以前发布,7300000.0,"78,868元/平",VR看装修 房本满两年 随时看房 
侨福苑南向三房两卫，安静不吵，精装修,侨福苑,淘金,4室2厅 ,119.28, 西南 , 其他 ,21,1996, 板楼,8, 7个月以前发布,8320000.0,"69,752元/平",VR房源 房本满五年 
丰景大厦 满五 原装电梯 三阳台 双卫 安静 通风采光好,丰景大厦,杨箕,4室2厅 ,135.33, 西北 , 简装 ,27,1998, 塔楼,3, 3个月以前发布,9800000.0,"72,416元/平",VR看装修 房本满五年 
少有户型，南向大阳台，高楼层视野宽阔,东山欣园,杨箕,5室2厅 ,215.66, 南 , 精装 ,29,2007, 塔楼,215, 9个月以前发布,22700000.0,"105,259元/平",VR看装修 房本满五年 
花城苑 二沙岛满5年 东南望花园泳池 采光好 安静舒适,二沙岛花城苑,二沙岛,3室2厅 ,150.92, 东南 西北 , 简装 ,7,1997, 塔楼,23, 2个月以前发布,18500000.0,"122,582元/平",VR房源 房本满五年 
本房源过五唯一，南望整个花园，中高楼层，通风采光好,锦城花园,东风东,4室2厅 ,192.0, 南 , 精装 ,26,2009, 塔楼,66, 一年前发布,14670000.0,"76,381元/平",近地铁 VR房源 房本满五年 
新建独栋3层 4房2厅3卫，安静安全 配套完善。,达道路,东山口,4室2厅 ,157.98, 东 南 西 , 精装 ,1,1993, 塔楼,19, 一年前发布,17800000.0,"112,673元/平",近地铁 VR房源 房本满五年 
君铂国际 高层南北向大四房视野好 农林下,君铂国际,环市东,4室2厅 ,161.22, 南 西 北 , 其他 ,40,2005, 塔楼,5, 4个月以前发布,14000000.0,"86,838元/平",VR房源 房本满五年 
五羊新城大型园林式小区满五唯一无抵押5房南向华宅,东海嘉园,五羊新城,5室2厅 ,159.93, 南 , 精装 ,32,2006, 塔楼,109, 3个月以前发布,17300000.0,"108,173元/平",近地铁 VR看装修 房本满五年 
凯旋会尊贵江景大宅  高层南向望珠江小蛮腰,凯旋会,五羊新城,5室2厅 ,350.64, 南 北 , 精装 ,48,2004, 塔楼,15, 一年前发布,68000000.0,"193,932元/平",近地铁 VR房源 房本满五年 
上清水濠 小面积 新装修 免增值税 近团一大地铁站,德政中路,农讲所,1室1厅 ,28.23, 东 西 , 其他 ,8,1990, 塔楼,0,15,1380000.0,"48,885元/平",VR看装修 房本满两年 随时看房 
邮电新村华乐路 2室1厅 西 北,邮电新村华乐路,建设路,2室1厅 ,63.23, 西 北 , 精装 ,9,1990, 塔楼,0,17,4280000.0,"67,690元/平",VR房源 房本满五年 
金山阁大两房 东向采光好 格局方正 过五年,金山阁,五羊新城,2室2厅 ,84.83, 东 , 精装 ,28,2000, 塔楼,0,16,5500000.0,"64,836元/平",近地铁 VR看装修 房本满五年 
小北省一级+原装电梯望越秀公园+满五可公积金,越秀花苑大厦,小北,1室1厅 ,45.76, 北 , 其他 ,20,1997, 塔楼,0,13,2900000.0,"63,375元/平",近地铁 VR看装修 房本满五年 
东湖御苑 户型方正 视野好 舒适三房,东湖御苑,东湖,3室1厅 ,125.93, 北 , 其他 ,51,2005, 塔楼,0,13,9450000.0,"75,042元/平",近地铁 VR看装修 房本满五年 
建设路青菜东街 首层单位 东南北向三面单边 楼距宽,先烈南路青菜东街,建设路,2室1厅 ,52.68, 南 北 , 简装 ,7,1990, 塔楼,0,11,3150000.0,"59,795元/平",VR看装修 房本满两年 
出门就是地铁口 高楼层 电梯准备动工 户型方正 采光好,下塘西路,麓景,2室1厅 ,67.53, 北 , 其他 ,9,1991, 塔楼,0,14,2700000.0,"39,983元/平",近地铁 VR看装修 房本满五年 
水均岗 2室1厅 东南,水均岗,东风东,2室1厅 ,53.94, 东南 , 其他 ,6,1990, 板楼,0,13,3660000.0,"67,854元/平",VR看装修 房本满五年 
恒鑫御园 2室1厅 西,恒鑫御园,公园前,2室1厅 ,67.29, 西 , 其他 ,32,1995, 塔楼,3,12,5000000.0,"74,306元/平",近地铁 VR看装修 房本满两年 
正佳东方国际 大套间 采光通风好 视野开阔 淘金上盖,正佳东方国际,淘金,1室0厅 ,69.0, 南 , 其他 ,55,2009, 塔楼,0,3,1750000.0,"25,363元/平",近地铁 房本满两年 
商品房 有保安值守的大院管理 面积大。,铁路大院,流花站前,2室1厅 ,56.2, 西 , 简装 ,7,1980, 塔楼,34, 一年前发布,1230000.0,"21,887元/平",近地铁 VR看装修 房本满五年 随时看房 
两房两卫房大厅大，视野采光好，证满5年，电梯,淘金大厦,淘金,2室2厅 ,101.36, 西北 , 精装 ,16,1993, 塔楼,0, 6个月以前发布,4600000.0,"45,383元/平",近地铁 VR看装修 房本满五年 随时看房 
三房二卫南北通透，视野采光好，证满5年，电梯,淘金大厦,淘金,3室2厅 ,100.4, 东 南 北 , 精装 ,16,1993, 塔楼,3, 6个月以前发布,4600000.0,"45,817元/平",近地铁 VR看装修 房本满五年 随时看房 
淘金华庭 大四房 满五唯一 高层南向，视野景观好,淘金华庭,淘金,4室2厅 ,146.68, 东南 , 其他 ,32,2002, 塔楼,7, 5个月以前发布,11500000.0,"78,402元/平",VR看装修 房本满五年 随时看房 
东风广场：三期两房  厅出阳台  望花园,东风广场,东风东,2室1厅 ,66.79, 西南 , 其他 ,36,2004, 板楼,15, 一年前发布,5470000.0,"81,754元/平",近地铁 VR房源 房本满五年 
越秀西华路低层正规2房，户型方正实用，生活配套成熟,西华路,西华路,2室1厅 ,48.0, 东南 , 精装 ,9,1994, 塔楼,31, 一年前发布,2080000.0,"43,334元/平",近地铁 VR看装修 房本满两年 随时看房 
81号大院，南北朝向，实用两房,先烈中路81号大院,黄花岗,2室1厅 ,52.6, 南 北 , 精装 ,6,1980, 板楼,31, 一年前发布,2960000.0,"56,274元/平",近地铁 VR看装修 房本满五年 
福今路 铁一  南北对流  户型方正实用 通风采光良好,福今路,东山口,2室2厅 ,74.0, 东 南 北 , 其他 ,9,1988, 板楼,9, 一年前发布,5800000.0,"78,379元/平",近地铁 VR看装修 房本满五年 随时看房 
中高层西南向、精.装大两房、拎包入住！,越秀上品轩,西门口,2室1厅 ,84.12, 西南 , 精装 ,31,2010, 塔楼,17, 4个月以前发布,5460000.0,"64,908元/平",近地铁 VR看装修 房本满五年 随时看房 
越秀区中楼层两房，采光好 看房方便,清水塘小区,沙河,2室1厅 ,53.06, 南 , 其他 ,6,1995, 塔楼,8, 一年前发布,2000000.0,"37,694元/平",VR看装修 房本满五年 随时看房 
交通方便  格局方正  实用房源  方正三房,越秀北路,小北,3室1厅 ,83.17, 东南 , 其他 ,9,1992, 塔楼,43, 一年前发布,3190000.0,"38,356元/平",近地铁 VR房源 房本满五年 随时看房 
近麓湖公园 下塘新村 东西对流户型方正  中层房改房,下塘新村,麓景,3室2厅 ,110.24, 东 西 , 简装 ,9,1998, 板楼,8, 7个月以前发布,4180000.0,"37,918元/平",近地铁 VR看装修 房本满五年 随时看房 
富宏花园+电梯楼高层+越秀公园,富宏花园,小北,3室1厅 ,113.15, 西北 , 精装 ,22,1997, 塔楼,12, 一年前发布,10180000.0,"89,970元/平",VR看装修 房本满五年 随时看房 
水荫路 精装修三房单位 户型方正 交通方便,水荫路,水荫,3室1厅 ,72.4, 东 , 精装 ,9,1987, 塔楼,24, 11个月以前发布,3950000.0,"54,559元/平",VR看装修 房本满五年 随时看房 
大院管理 环境优雅 楼层优质  精装修南北对流,永福路89号大院,沙河,3室2厅 ,95.13, 南 北 , 精装 ,9,1997, 塔楼,6, 一年前发布,4600000.0,"48,355元/平",VR看装修 房本满五年 随时看房 
旺中带静 南北对流 一梯两户 户型方正 采光好,越秀南路,越秀南,3室1厅 ,65.0, 北 , 简装 ,7,1998, 塔楼,0, 2个月以前发布,3000000.0,"46,154元/平",VR房源 房本满两年 随时看房 
东风广场顶层带独立使用天台花园，安静不吵。,东风广场,东风东,4室2厅 ,158.99, 西南 , 简装 ,39,1998, 塔楼,48, 一年前发布,13000000.0,"81,754元/平",近地铁 VR看装修 房本满五年 随时看房 
三房两厅高层，白云山景观净收眼底，近地铁,麓湖阁,淘金,3室2厅 ,104.6, 西北 , 精装 ,28,2001, 板塔结合,7, 10个月以前发布,6350000.0,"60,708元/平",VR看装修 房本满两年 随时看房 
东山领汇广场 2室1厅 北,东山领汇广场,杨箕,2室1厅 ,71.87, 北 , 精装 ,36,2011, 塔楼,128, 一年前发布,7300000.0,"101,573元/平",近地铁 VR看装修 房本满五年 随时看房 
云鹤南街精装修三房 采光通风安静不吵 全明房过五年,环市东路,环市东,3室2厅 ,73.12, 东南 , 其他 ,9,1996, 塔楼,3, 3个月以前发布,4150000.0,"56,757元/平",VR看装修 房本满五年 随时看房 
泰康城广场 2室1厅 北,泰康城广场,海珠广场,2室1厅 ,86.52, 北 , 精装 ,39,1997, 塔楼,0, 2个月以前发布,4480000.0,"51,780元/平",VR看装修 房本满五年 随时看房 
恒鑫御园 小区管理 朝天路 东北朝向 带大阳台,恒鑫御园,公园前,2室1厅 ,68.09, 东北 , 简装 ,32,1995, 塔楼,30, 6个月以前发布,4850000.0,"71,230元/平",近地铁 VR看装修 房本满五年 随时看房 
南向三房2卫 精装修 采光通风好 安静舒适 位置好,金地大厦,淘金,3室2厅 ,97.38, 南 , 其他 ,32,1999, 塔楼,5, 2个月以前发布,7600000.0,"78,045元/平",VR看装修 房本满五年 随时看房 
商圈改造青菜东街小区 中层精装三房南北对流,先烈南路青菜东街,建设路,3室1厅 ,68.72, 南 北 , 精装 ,7,1990, 塔楼,33, 一年前发布,4150000.0,"60,390元/平",近地铁 VR看装修 房本满五年 随时看房 
越秀区云山 该房满五唯一 户型方正 视野采光好,广园东路,沙河,4室2厅 ,115.71, 南 北 , 简装 ,8,1999, 塔楼,23, 一年前发布,3450000.0,"29,816元/平",VR看装修 房本满五年 随时看房 
永福楼，电梯，高层，南向，采光通风好,永福楼,黄花岗,3室2厅 ,110.72, 南 , 简装 ,25,1993, 塔楼,18, 9个月以前发布,4390000.0,"39,650元/平",VR房源 房本满五年 随时看房 
越秀区 花园小区  全明屋 户型方正两房 采光通风好,华秀苑,机场路,2室2厅 ,67.1, 南 , 简装 ,9,1995, 塔楼,79, 一年前发布,1580000.0,"23,547元/平",VR看装修 房本满五年 随时看房 
东风东路 3室1厅 南 北,东风东路,东风东,3室1厅 ,99.28, 南 北 , 精装 ,13,1990, 塔楼,38, 一年前发布,4550000.0,"45,830元/平",近地铁 VR看装修 房本满五年 随时看房 
广医大院 两房一厅 原东风西 大院管理,广医小区,盘福,2室1厅 ,62.0, 南 , 简装 ,9,1995, 塔楼,1, 2个月以前发布,3960000.0,"63,871元/平",VR看装修 房本满五年 随时看房 
东兴大厦，电梯楼，实用三房，格局方正，诚意出,东兴大厦,环市东,3室2厅 ,103.0, 南 , 简装 ,25,1990, 塔楼,27, 5个月以前发布,4900000.0,"47,573元/平",近地铁 VR看装修 房本满五年 随时看房 
户型方正，低层大三房，近桂花岗，大院管理,花果山社区,桂花岗,3室1厅 ,100.96, 东 , 其他 ,9,1992, 塔楼,10, 一年前发布,3900000.0,"38,630元/平",VR看装修 房本满五年 随时看房 
原小北，中低楼层，装修保养新，越秀公园省府旁,小北路,小北,2室1厅 ,57.24, 东 , 精装 ,9,1996, 塔楼,13, 一年前发布,4050000.0,"70,755元/平",近地铁 VR看装修 房本满五年 随时看房 
东山口培正，中间楼层，大院管理，安静采光好,山河后街61号大院,东山口,3室1厅 ,77.0, 南 , 其他 ,5,1991, 塔楼,25, 8个月以前发布,6380000.0,"82,858元/平",近地铁 VR看装修 房本满五年 随时看房 
嘉诚国际公寓两房 户型方正 视野开阔 交通便利,嘉诚国际公寓,水荫,2室1厅 ,58.99, 东 , 简装 ,29,2007, 塔楼,29, 一年前发布,3380000.0,"57,298元/平",VR看装修 房本满五年 随时看房 
越秀区云山 该房满五唯一 户型方正 视野采光好,广园东路,沙河,4室2厅 ,115.71, 南 北 , 简装 ,8,1999, 塔楼,23, 一年前发布,3450000.0,"29,816元/平",VR看装修 房本满五年 随时看房 
东风东 地铁口电梯房 有20方平台,农林下路,东山口,2室1厅 ,66.92, 南 西 北 , 简装 ,9,1992, 板楼,5, 5个月以前发布,6500000.0,"97,131元/平",近地铁 VR看装修 房本满五年 随时看房 
应元大厦 2室2厅 东南 南 东,应元大厦,小北,2室2厅 ,100.3, 东南 南 东 , 其他 ,22,1997, 塔楼,0, 1个月以前发布,8500000.0,"84,746元/平",近地铁 VR房源 房本满五年 随时看房 
东兴大厦，电梯楼，实用三房，格局方正，诚意出,东兴大厦,环市东,3室2厅 ,103.0, 南 , 简装 ,25,1990, 塔楼,27, 5个月以前发布,4900000.0,"47,573元/平",近地铁 VR看装修 房本满五年 随时看房 
碧翠苑，电梯三房，马赛克小区房 ，环境安静，过五年,碧翠苑,麓景,3室1厅 ,96.21, 西 , 简装 ,9,1996, 塔楼,12, 一年前发布,4050000.0,"42,096元/平",VR看装修 房本满五年 随时看房 
户型方正，低层大三房，近桂花岗，大院管理,花果山社区,桂花岗,3室1厅 ,100.96, 东 , 其他 ,9,1992, 塔楼,10, 一年前发布,3900000.0,"38,630元/平",VR看装修 房本满五年 随时看房 
越秀区 花园小区  全明屋 户型方正两房 采光通风好,华秀苑,机场路,2室2厅 ,67.1, 南 , 简装 ,9,1995, 塔楼,79, 一年前发布,1580000.0,"23,547元/平",VR看装修 房本满五年 随时看房 
东风东路 3室1厅 南 北,东风东路,东风东,3室1厅 ,99.28, 南 北 , 精装 ,13,1990, 塔楼,38, 一年前发布,4550000.0,"45,830元/平",近地铁 VR看装修 房本满五年 随时看房 
广医大院 两房一厅 原东风西 大院管理,广医小区,盘福,2室1厅 ,62.0, 南 , 简装 ,9,1995, 塔楼,1, 2个月以前发布,3960000.0,"63,871元/平",VR看装修 房本满五年 随时看房 
永福楼，电梯，高层，南向，采光通风好,永福楼,黄花岗,3室2厅 ,110.72, 南 , 简装 ,25,1993, 塔楼,18, 9个月以前发布,4390000.0,"39,650元/平",VR房源 房本满五年 随时看房 
越秀区物业  莲泉大厦 过五年  三房 采光好 地铁附 近,莲泉大厦,三元里,3室1厅 ,97.0, 东南 , 简装 ,9,1998, 塔楼,31, 6个月以前发布,1990000.0,"20,516元/平",近地铁 VR看装修 房本满五年 随时看房 
越秀区 北站路 三元里地铁  房大厅大两房 光线充足,新时代宿舍(北站路),三元里,2室1厅 ,90.0, 东 , 简装 ,9,1998, 塔楼,5, 2个月以前发布,1750000.0,"19,445元/平",近地铁 VR看装修 房本满两年 随时看房 
恒福路实用三房，麓湖边上，业主有心卖。,恒福路,淘金,3室1厅 ,69.74, 南 北 , 其他 ,9,1988, 塔楼,12, 6个月以前发布,2350000.0,"33,697元/平",VR看装修 房本满五年 随时看房 
大院里边 楼龄新 一梯四户 实用率高 正规三房,横枝岗56号大院,麓景,3室2厅 ,74.0, 东 南 , 精装 ,5,1992, 塔楼,4, 10个月以前发布,3180000.0,"42,973元/平",VR看装修 房本满五年 随时看房 
嘉和苑 望花园 中楼层 实用三房 配套好,嘉和苑,东风西,3室1厅 ,74.85, 南 北 , 简装 ,19,1999, 塔楼,55, 一年前发布,4410000.0,"58,918元/平",VR看装修 房本满五年 随时看房 
黄花新村安静三房  交通便利  实用率可以去到90方左右,黄花新村,淘金,3室1厅 ,66.8, 东南 , 其他 ,6,1985, 塔楼,0, 1个月以前发布,3850000.0,"57,635元/平",近地铁 VR看装修 房本满两年 随时看房 
临江物业 南北对流 实用大三房 证满五年,中冠大厦,五羊新城,3室2厅 ,116.23, 南 西 北 , 简装 ,9,1995, 塔楼,7, 3个月以前发布,5470000.0,"47,062元/平",近地铁 VR房源 房本满五年 随时看房 
地铁边 方正两房 东南单边 大阳台 通风透气采光佳,环市东路435号大院,黄花岗,2室1厅 ,76.91, 南 北 , 简装 ,8,1996, 塔楼,313, 4个月以前发布,4380000.0,"56,950元/平",近地铁 VR看装修 房本满五年 随时看房 
临江物业 南北对流 实用大三房 证满五年,中冠大厦,五羊新城,3室2厅 ,116.23, 南 西 北 , 简装 ,9,1995, 塔楼,7, 3个月以前发布,5470000.0,"47,062元/平",近地铁 VR房源 房本满五年 随时看房 
永福楼，小区管理，视野开阔，采光和通风好,永福楼,黄花岗,3室2厅 ,133.77, 东北 , 简装 ,25,1993, 塔楼,19, 一年前发布,5400000.0,"40,368元/平",近地铁 VR看装修 房本满五年 随时看房 
乐韵居朝小  地铁口 楼龄新 带天台花园  方正大两房,乐韵居,西门口,2室1厅 ,73.02, 东北 , 精装 ,9,2000, 塔楼,7, 9个月以前发布,3080000.0,"42,181元/平",近地铁 VR看装修 房本满五年 随时看房 
福今路大院 南北向 三房 户型方正 使用率高 安静不吵,福今路3号大院,东山口,4室2厅 ,108.4, 东 南 西 , 其他 ,9,1990, 塔楼,6, 4个月以前发布,7480000.0,"69,004元/平",近地铁 VR房源 房本满五年 随时看房 
中高楼层 利福大厦 精装修 两房,利福大厦,北京路,2室1厅 ,56.06, 南 , 其他 ,24,1992, 塔楼,8, 7个月以前发布,3100000.0,"55,298元/平",VR看装修 房本满两年 随时看房 
农林下路电梯两房改三房，业主诚心放卖,农林下路,东山口,3室1厅 ,75.92, 东 西 , 精装 ,9,1988, 板楼,10, 6个月以前发布,5350000.0,"70,469元/平",VR看装修 房本满两年 随时看房 
小北路 南北向三房 生活便利 环境安静,小北路,小北,3室1厅 ,61.42, 南 北 , 其他 ,8,1990, 塔楼,2, 7个月以前发布,4750000.0,"77,337元/平",近地铁 VR看装修 房本满五年 随时看房 
世贸花园，房子采光好，离淘金地铁300米，电梯房,世贸花园,淘金,2室1厅 ,77.0, 东 , 简装 ,25,2001, 塔楼,5, 一年前发布,4800000.0,"62,338元/平",VR看装修 房本满五年 随时看房 
新收 恒福路三房 带天台花园 过五年税费少 有钥匙看房,恒福路,淘金,3室1厅 ,81.09, 东 南 , 精装 ,9,1988, 塔楼,35, 7个月以前发布,2790000.0,"34,407元/平",近地铁 VR看装修 房本满五年 随时看房 
大院里边 楼龄新 一梯四户 实用率高 正规三房,横枝岗56号大院,麓景,3室2厅 ,74.0, 东 南 , 精装 ,5,1992, 塔楼,4, 10个月以前发布,3180000.0,"42,973元/平",VR看装修 房本满五年 随时看房 
嘉和苑 望花园 中楼层 实用三房 配套好,嘉和苑,东风西,3室1厅 ,74.85, 南 北 , 简装 ,19,1999, 塔楼,55, 一年前发布,4410000.0,"58,918元/平",VR看装修 房本满五年 随时看房 
满五唯一  框架  总*低 南北向 采光充足 正规两房,永福路永福西约,黄花岗,2室1厅 ,44.6, 南 北 , 其他 ,8,1992, 塔楼,31, 一年前发布,1850000.0,"41,480元/平",近地铁 VR看装修 房本满五年 随时看房 
公园前 北京路步行街商圈  住家装修两房一厅 回民,惠福东路,北京路,2室1厅 ,54.37, 北 , 精装 ,10,1995, 塔楼,10, 10个月以前发布,1950000.0,"35,866元/平",近地铁 VR看装修 房本满五年 随时看房 
百灵路知用球场旁5楼3房有阳台有管道,百灵路,西门口,3室1厅 ,45.08, 东南 , 精装 ,7,1985, 塔楼,36, 7个月以前发布,1580000.0,"35,049元/平",近地铁 VR看装修 房本满两年 随时看房 
越秀区中层三房带主套  轻奢大方舒适新装修,西华路,西华路,3室2厅 ,79.66, 东 西 , 其他 ,9,1995, 塔楼,2, 一年前发布,3280000.0,"41,175元/平",近地铁 VR看装修 房本满五年 随时看房 
碧翠苑 小区管理 电梯高层 两房一厅,碧翠苑,麓景,2室1厅 ,55.42, 东 , 其他 ,9,1998, 塔楼,17, 一年前发布,2530000.0,"45,652元/平",VR看装修 房本满五年 随时看房 
东山口原装电梯精装修三房 高楼层采光好 东南朝向,柏丽雅居,东川路,3室1厅 ,108.95, 东南 , 精装 ,17,2000, 塔楼,77, 6个月以前发布,6780000.0,"62,231元/平",VR房源 房本满两年 随时看房 
党校大院 小区管理 电梯南向两房 环境舒适,省委党校大院,建设路,2室1厅 ,70.51, 南 , 其他 ,9,1995, 塔楼,65, 一年前发布,5280000.0,"74,883元/平",近地铁 VR看装修 房本满五年 随时看房 
海平阁 中高层电梯3房 格局方正 地铁口物业,海平阁,五羊新城,3室1厅 ,98.0, 西北 , 简装 ,26,1993, 塔楼,96, 一年前发布,6000000.0,"61,225元/平",近地铁 VR看装修 房本满五年 随时看房 
环市东路天胜村  看房方便 楼层好 双阳台 框架有电梯,天胜村,淘金,3室1厅 ,75.14, 南 北 , 简装 ,7,1970, 塔楼,13, 6个月以前发布,5250000.0,"69,870元/平",近地铁 VR看装修 房本满两年 随时看房 
交通方便，小区安静、、配套齐全,五羊小区,五羊新城,2室1厅 ,75.59, 北 , 简装 ,9,1986, 塔楼,36, 一年前发布,4500000.0,"59,532元/平",近地铁 VR看装修 房本满五年 随时看房 
水荫路少有在*的两房大户型，满五唯一，东南向,嘉诚国际公寓,水荫,3室1厅 ,106.55, 东南 , 精装 ,29,2007, 塔楼,126, 一年前发布,4900000.0,"45,988元/平",VR房源 房本满五年 随时看房 
装修保养好，宽敞好户型，有阳台，有书房,明泉花园,机场路,4室2厅 ,142.74, 南 , 简装 ,9,2000, 塔楼,11, 一年前发布,2800000.0,"19,617元/平",VR看装修 房本满两年 随时看房 
观湖雅轩 近流花湖公园 空气好,观湖雅轩,东风西,2室2厅 ,96.76, 西南 , 其他 ,16,1999, 塔楼,32, 一年前发布,4000000.0,"41,340元/平",近地铁 VR看装修 房本满两年 随时看房 
三眼井社区 小北 精装修 带小花园 近越秀公园 环境好,机关宿舍,小北,3室2厅 ,63.88, 南 北 , 精装 ,7,1990, 塔楼,6, 5个月以前发布,5260000.0,"82,342元/平",近地铁 VR房源 房本满五年 随时看房 
云鹤园小区 2楼两房 证满五年 小区管理好,云鹤园,环市东,2室1厅 ,60.28, 南 , 毛坯 ,4,1982, 板楼,22, 5个月以前发布,2800000.0,"46,450元/平",VR看装修 房本满五年 随时看房 
原装电梯房，下楼就是珠江边，北向安静,天字广场,海珠广场,1室1厅 ,82.0, 北 , 其他 ,29,2001, 塔楼,1, 3个月以前发布,3940000.0,"48,049元/平",近地铁 VR看装修 房本满两年 随时看房 
下塘新村 精装三房 大院管理 户型方正,下塘新村,麓景,3室2厅 ,80.94, 西南 , 精装 ,9,1990, 塔楼,5, 2个月以前发布,3460000.0,"42,748元/平",近地铁 VR看装修 房本满五年 随时看房 
公园前 北京路步行街商圈  住家装修两房一厅 回民,惠福东路,北京路,2室1厅 ,54.37, 北 , 精装 ,10,1995, 塔楼,10, 10个月以前发布,1950000.0,"35,866元/平",近地铁 VR看装修 房本满五年 随时看房 
2006年金麓山庄，安静望山，户型实用。证过5年，低税,金麓山庄,麓景,2室1厅 ,53.79, 西 , 其他 ,7,2005, 塔楼,9, 一年前发布,2680000.0,"49,824元/平",VR看装修 房本满五年 随时看房 
淘金北华侨乐园大三房，总JIA低。,华侨乐园,淘金,3室2厅 ,133.04, 东北 , 精装 ,18,1995, 塔楼,5, 3个月以前发布,6730000.0,"50,587元/平",VR看装修 房本满五年 随时看房 
淘金大厦中楼层 安静舒适 交通便利,淘金大厦,淘金,3室2厅 ,101.31, 东北 , 简装 ,16,1993, 塔楼,25, 一年前发布,3550000.0,"35,041元/平",近地铁 VR看装修 房本满五年 随时看房 
北京路地铁，仙湖街小区，底层二楼，精装修4房,大南路,北京路,4室2厅 ,93.79, 东南 北 , 精装 ,6,1995, 板楼,1, 1个月以前发布,3450000.0,"36,785元/平",VR看装修 房本满五年 随时看房 
高楼层南向望江 原装电梯房 采光通风好,泰康城广场,海珠广场,2室1厅 ,95.81, 南 , 精装 ,39,1997, 塔楼,0, 1个月以前发布,4880000.0,"50,935元/平",VR看装修 房本满五年 随时看房 
永福楼，小区管理，视野开阔，采光和通风好,永福楼,黄花岗,3室2厅 ,133.77, 东北 , 简装 ,25,1993, 塔楼,19, 一年前发布,5400000.0,"40,368元/平",近地铁 VR看装修 房本满五年 随时看房 
实用四房 步梯中层 房改房 无占用 全明格局,水荫直街,水荫,4室1厅 ,98.34, 北 , 简装 ,9,1992, 塔楼,50, 一年前发布,4450000.0,"45,252元/平",近地铁 VR看装修 房本满五年 随时看房 
南向大三房，采光通风好近地铁交 通方便,五羊小区,五羊新城,3室1厅 ,81.74, 东南 南 , 简装 ,9,1986, 塔楼,19, 6个月以前发布,4900000.0,"59,947元/平",近地铁 VR看装修 房本满五年 随时看房 
麓湖雕塑公园天然氧吧+电梯小区管理+省一级+安静,碧翠苑,麓景,3室2厅 ,97.69, 南 , 其他 ,9,1997, 塔楼,32, 一年前发布,4190000.0,"42,891元/平",VR看装修 房本满五年 随时看房 
金濠大厦 3室2厅 东北,金濠大厦,建设路,3室2厅 ,68.14, 东北 , 其他 ,17,2000, 塔楼,8, 9个月以前发布,3680000.0,"54,007元/平",近地铁 VR看装修 房本满五年 随时看房 
